{
  "$schema": "http://json-schema.org/draft-07/schema#",
  "type": "object",
  "required": ["favicons"],
  "additionalProperties": false,
  "properties": {
    "favicons": {
      "type": "object",
      "additionalProperties": false,
      "patternProperties": {
        "^[A-Za-z0-9-_]+\\.png$": {
          "type": "object",
          "required": [
            "width",
            "height",
            "rel",
            "type",
            "transparent",
            "mask",
            "shadow",
            "emitTag"
          ],
          "additionalProperties": false,
          "properties": {
            "width": {
              "type": "number",
              "enum": [16, 32, 48, 96]
            },
            "height": {
              "type": "number",
              "enum": [16, 32, 48, 96]
            },
            "rel": {
              "type": "string",
              "enum": ["icon"]
            },
            "type": {
              "type": "string",
              "enum": ["image/png"]
            },
            "transparent": {
              "type": "boolean"
            },
            "mask": {
              "type": "boolean"
            },
            "shadow": {
              "type": "boolean"
            },
            "emitTag": {
              "type": "boolean"
            }
          }
        }
      }
    },
    "android": {
      "type": "object",
      "additionalProperties": false,
      "patternProperties": {
        "^[A-Za-z0-9-_]+\\.png$": {
          "type": "object",
          "required": [
            "width",
            "height",
            "rel",
            "type",
            "transparent",
            "mask",
            "shadow",
            "emitTag"
          ],
          "additionalProperties": false,
          "properties": {
            "width": {
              "type": "number",
              "enum": [128, 192, 196, 256, 512]
            },
            "height": {
              "type": "number",
              "enum": [128, 192, 196, 256, 512]
            },
            "rel": {
              "type": "string",
              "enum": ["icon"]
            },
            "type": {
              "type": "string",
              "enum": ["image/png"]
            },
            "transparent": {
              "type": "boolean"
            },
            "mask": {
              "type": "boolean"
            },
            "shadow": {
              "type": "boolean"
            },
            "emitTag": {
              "type": "boolean"
            }
          }
        }
      }
    },
    "apple": {
      "type": "object",
      "additionalProperties": false,
      "patternProperties": {
        "^[A-Za-z0-9-_]+\\.png$": {
          "type": "object",
          "required": [
            "width",
            "height",
            "rel",
            "type",
            "transparent",
            "mask",
            "shadow",
            "emitTag"
          ],
          "additionalProperties": false,
          "properties": {
            "width": {
              "type": "number",
              "enum": [128, 152, 167, 180]
            },
            "height": {
              "type": "number",
              "enum": [128, 152, 167, 180]
            },
            "rel": {
              "type": "string",
              "enum": ["apple-touch-icon"]
            },
            "type": {
              "type": "string",
              "enum": ["image/png"]
            },
            "transparent": {
              "type": "boolean"
            },
            "mask": {
              "type": "boolean"
            },
            "shadow": {
              "type": "boolean"
            },
            "emitTag": {
              "type": "boolean"
            }
          }
        }
      }
    },
    "appleStartup": {
      "type": "object",
      "additionalProperties": false,
      "patternProperties": {
        "^[A-Za-z0-9-_]+\\.png$": {
          "type": "object",
          "required": [
            "dwidth",
            "dheight",
            "ratio",
            "rel",
            "type",
            "transparent",
            "mask",
            "shadow",
            "emitTag"
          ],
          "additionalProperties": false,
          "properties": {
            "dwidth": {
              "type": "number"
            },
            "dheight": {
              "type": "number"
            },
            "ratio": {
              "type": "number",
              "enum": [1, 2, 3]
            },
            "rel": {
              "type": "string",
              "enum": ["apple-touch-startup-image"]
            },
            "type": {
              "type": "string",
              "enum": ["image/png"]
            },
            "transparent": {
              "type": "boolean"
            },
            "mask": {
              "type": "boolean"
            },
            "shadow": {
              "type": "boolean"
            },
            "emitTag": {
              "type": "boolean"
            }
          }
        }
      }
    },
    "windows": {
      "type": "object",
      "required": ["mstile-70x70.png"],
      "additionalProperties": false,
      "properties": {
        "mstile-70x70.png": {
          "type": "object",
          "required": [
            "width",
            "height",
            "rel",
            "type",
            "transparent",
            "mask",
            "shadow",
            "emitTag"
          ],
          "additionalProperties": false,
          "properties": {
            "width": {
              "type": "number",
              "enum": [70]
            },
            "height": {
              "type": "number",
              "enum": [70]
            },
            "rel": {
              "type": "string",
              "enum": ["icon"]
            },
            "type": {
              "type": "string",
              "enum": ["image/png"]
            },
            "transparent": {
              "type": "boolean"
            },
            "mask": {
              "type": "boolean"
            },
            "shadow": {
              "type": "boolean"
            },
            "emitTag": {
              "type": "boolean"
            }
          }
        },
        "mstile-270x270.png": {
          "type": "object",
          "required": [
            "width",
            "height",
            "rel",
            "type",
            "transparent",
            "mask",
            "shadow",
            "emitTag"
          ],
          "additionalProperties": false,
          "properties": {
            "width": {
              "type": "number",
              "enum": [270]
            },
            "height": {
              "type": "number",
              "enum": [270]
            },
            "rel": {
              "type": "string",
              "enum": ["icon"]
            },
            "type": {
              "type": "string",
              "enum": ["image/png"]
            },
            "transparent": {
              "type": "boolean"
            },
            "mask": {
              "type": "boolean"
            },
            "shadow": {
              "type": "boolean"
            },
            "emitTag": {
              "type": "boolean"
            }
          }
        },
        "mstile-310x310.png": {
          "type": "object",
          "required": [
            "width",
            "height",
            "rel",
            "type",
            "transparent",
            "mask",
            "shadow",
            "emitTag"
          ],
          "additionalProperties": false,
          "properties": {
            "width": {
              "type": "number",
              "enum": [310]
            },
            "height": {
              "type": "number",
              "enum": [310]
            },
            "rel": {
              "type": "string",
              "enum": ["icon"]
            },
            "type": {
              "type": "string",
              "enum": ["image/png"]
            },
            "transparent": {
              "type": "boolean"
            },
            "mask": {
              "type": "boolean"
            },
            "shadow": {
              "type": "boolean"
            },
            "emitTag": {
              "type": "boolean"
            }
          }
        },
        "mstile-310x150.png": {
          "type": "object",
          "required": [
            "width",
            "height",
            "rel",
            "type",
            "transparent",
            "mask",
            "shadow",
            "emitTag"
          ],
          "additionalProperties": false,
          "properties": {
            "width": {
              "type": "number",
              "enum": [310]
            },
            "height": {
              "type": "number",
              "enum": [150]
            },
            "rel": {
              "type": "string",
              "enum": ["icon"]
            },
            "type": {
              "type": "string",
              "enum": ["image/png"]
            },
            "transparent": {
              "type": "boolean"
            },
            "mask": {
              "type": "boolean"
            },
            "shadow": {
              "type": "boolean"
            },
            "emitTag": {
              "type": "boolean"
            }
          }
        }
      }
    },
    "safari": {
      "type": "object",
      "additionalProperties": false,
      "required": ["safari-pinned-tab.svg"],
      "properties": {
        "safari-pinned-tab.svg": {
          "type": "object",
          "additionalProperties": false,
          "required": ["width", "height", "rel", "type", "emitTag"],
          "properties": {
            "color": {
              "type": "string",
              "pattern": "^#([0-9abcdef]{3}|[0-9abcdef]{6})$"
            },
            "width": {
              "type": "number",
              "enum": [16]
            },
            "height": {
              "type": "number",
              "enum": [16]
            },
            "rel": {
              "type": "string",
              "enum": ["mask-icon"]
            },
            "type": {
              "type": "string",
              "enum": ["image/svg+xml"]
            },
            "emitTag": {
              "type": "boolean"
            }
          }
        }
      }
    },
    "coast": {
      "type": "object",
      "additionalProperties": false,
      "patternProperties": {
        "^[A-Za-z0-9-_]+\\.png$": {
          "type": "object",
          "required": [
            "width",
            "height",
            "rel",
            "type",
            "transparent",
            "mask",
            "shadow",
            "emitTag"
          ],
          "additionalProperties": false,
          "properties": {
            "width": {
              "type": "number",
              "enum": [228]
            },
            "height": {
              "type": "number",
              "enum": [228]
            },
            "rel": {
              "type": "string",
              "enum": ["icon"]
            },
            "type": {
              "type": "string",
              "enum": ["image/png"]
            },
            "transparent": {
              "type": "boolean"
            },
            "mask": {
              "type": "boolean"
            },
            "shadow": {
              "type": "boolean"
            },
            "emitTag": {
              "type": "boolean"
            }
          }
        }
      }
    }
  }
}
